{
  "packet_id": "sm-watch-001",
  "created_at": "2026-03-20T14:00:00Z",
  "symbols": ["AAPL", "MSFT"],
  "watch_reason": "Tech earnings season; evaluating AI narrative impact",
  "time_horizon": "short-term",
  "risk_tolerance": "moderate",
  "notes": "Focus on services growth and cloud commentary"
}
